question,answer,remarks,improvements,question_clean,answer_clean,remarks_clean,improvements_clean
[Fundamentals]Explain why error-correction coding is essential in watermark embedding and describe one common coding scheme,"Error-correction coding adds redundancy to the watermark message so that bits lost or corrupted during attacks or benign processing can be recovered at detection. A common scheme is BCH coding, which appends parity-check bits that allow the decoder to detect and correct multiple random bit errors, greatly improving robustness under noisy channels or JPEG compression.",,,[ fundamental ] explain why error-correction coding is essential in watermark embedding describe common coding scheme,"error-correction coding add redundancy to the watermark message so bit lost or corrupted attack or benign processing can be recovered at detection . a common scheme is bch coding , appends parity-check bit allow the decoder to detect and correct multiple random bit error , greatly improving ROBUSTNESS noisy channel or JPEG compression .",,
[WM-Informed] Describe the role of side information in informed watermarking and how it affects capacity and robustness.,"Side information refers to knowledge of the host signal at embedding time. By using the original media statistics, the embedder can choose coefficients or pixels that will least disturb perceptual quality and are least likely to be attacked, thus increasing capacity while maintaining imperceptibility. Detection can also exploit side information to reduce false positives.",,,[ wm-informed ] describe role of side information in informed WATERMARKING how it affect CAPACITY ROBUSTNESS .,"side information refers to knowledge of the host signal at embedding time . by using the original medium statistic , the embedder can choose coefficient or pixel least disturb perceptual quality and are least likely to be attacked , thus increasing CAPACITY maintaining imperceptibility . detection can also exploit side information to reduce false positive .",,
[WM-Properties] What are the main properties a good digital watermark should exhibit?,"A strong watermark is imperceptible (invisible to human senses), robust (survives common attacks like compression or filtering), secure (resists unauthorized detection or removal), and has sufficient payload capacity and real-time embeddability. It should also allow reliable synchronization for extraction.",,,[ wm-properties ] what are main property a good digital watermark exhibit ?,"a strong watermark is imperceptible ( invisible to human sens ) , robust ( survives common attack compression or filtering ) , secure ( resists unauthorized detection or removal ) , and ha sufficient PAYLOAD CAPACITY and real-time embeddability . it also allow reliable synchronization for extraction .",,
[WM-LSBvsQuant] Compare and contrast spatial-domain LSB watermarking with quantization-based watermarking in the transform domain.,"LSB embedding directly flips least significant bits of pixels for simplicity and high capacity but is fragile to any pixel-level change. Quantization watermarking (e.g., QIM) perturbs transform coefficients by quantizing them into one of two sets, which trades off capacity for considerably greater robustness under compression or noise.",,,[ wm-lsbvsquant ] compare contrast spatial-domain LSB WATERMARKING quantization-based WATERMARKING in transform domain .,"LSB embedding directly flip least significant bit of pixel for simplicity and high CAPACITY but is fragile to pixel-level change . quantization WATERMARKING ( e.g . qim ) perturbs transform coefficient by quantizing of set , trade CAPACITY for considerably greater ROBUSTNESS compression or noise .",,
[WM-DWTSteps] Outline the steps of DWT-based watermark embedding and why multi-resolution helps,"First, apply a discrete wavelet transform to decompose the image into subbands (LL, LH, HL, HH). Then embed the watermark into selected subband coefficients (often mid-frequency). Multi-resolution lets you hide in both coarse and fine details, balancing imperceptibility and robustness: coarse scales survive heavy filtering, fine scales carry high-capacity bits.",,,[ wm-dwtsteps ] step of dwt-based watermark embedding why multi-resolution help,"first , apply a discrete wavelet transform to decompose the image subbands ( ll , lh , hl , hh ) . then embed the watermark selected subband coefficient ( often mid-frequency ) . multi-resolution let hide in coarse and fine detail , balancing imperceptibility and ROBUSTNESS : coarse scale survive heavy filtering , fine scale carry high-capacity bit .",,
"[WM-CorrelationDetection] How does correlation-based watermark detection work, and what statistical thresholding is applied?","The detector computes the correlation between the received signal (or its transform coefficients) and the known watermark sequence. A threshold—often based on Gaussian noise assumptions—is set so that if the correlation exceeds it, the watermark is declared present. Proper thresholding controls false positives and misses.",,,"[ wm-correlationdetection ] how doe correlation-based watermark detection work , what statistical thresholding is applied ?","the detector computes the correlation the received signal ( or transform coefficient ) and the known watermark sequence . a threshold often based on gaussian noise assumption is set so the correlation exceeds it , the watermark is declared present . proper thresholding control false positive and miss .",,
[WM-VectorMapping] Explain mapping a watermark message into vectors and the need for spreading codes.,"The binary watermark message is first grouped into symbols and then mapped onto pseudo-random vectors (spreading codes). Spreading distributes the watermark energy over many host samples, making it less perceptible and more robust to interference; the detector uses the same codes to despread and retrieve the message.",,,[ wm-vectormapping ] explain mapping a watermark message vector need for spreading code .,"the binary watermark message is first grouped symbol and then mapped pseudo-random vector ( spreading code ) . spreading distributes the watermark energy many host sample , making it less perceptible and more robust to interference ; the detector us the same code to despread and retrieve the message .",,
"[WM-Fragile] What are fragile watermarks, and how are they applied for tamper detection?","Fragile watermarks are designed to break under any modification. Embedding often touches all pixels or blocks: even a single-bit change alters the extracted watermark checksum. By comparing the extracted pattern to the original, one can detect tampered regions with localization accuracy.",,,"[ wm-fragile ] what are fragile watermark , how are applied for tamper detection ?","fragile watermark are designed to break modification . embedding often touch pixel or block : even a single-bit change alters the extracted watermark checksum . by comparing the extracted pattern to the original , can detect tampered region localization accuracy .",,
[WM-SemiFragile] Define semi-fragile watermarking and give an example where it’s preferred.,"Semi-fragile watermarks tolerate benign changes (e.g., JPEG compression) but break under malicious tampering (e.g., content splicing). A photo-journalism authentication scheme uses semi-fragile watermarking so compressed web images still validate, while any splicing or deletion triggers an alert.",,,[ wm-semifragile ] define semi-fragile WATERMARKING give example where it s preferred .,"semi-fragile watermark tolerate benign change ( e.g . JPEG compression ) but break malicious tampering ( e.g . content splicing ) . a photo-journalism authentication scheme us semi-fragile WATERMARKING so compressed web image still validate , splicing or deletion trigger alert .",,
[WM-AttackTools] Detail the main categories of watermark-attack tools and one example of each.,"Attacks fall into removal (e.g., denoising filters), geometric (e.g., rotation, scaling), cryptographic (key estimation), and protocol (copy-attack). A removal attack example is median filtering; a geometric attack is random crop-and-paste; a cryptographic attack brute-forces embedding strength.",,,[ wm-attacktools ] detail main category of watermark-attack tool example of .,"attack fall removal ( e.g . denoising filter ) , geometric ( e.g . rotation , scaling ) , cryptographic ( key estimation ) , and protocol ( copy-attack ) . a removal attack example is median filtering ; a geometric attack is random crop-and-paste ; a cryptographic attack brute-forces embedding strength .",,
[WM-ExactVsSelectiveAuth] How does exact content authentication via watermarking differ from selective authentication?,"Exact authentication flags any change as illicit, using fragile watermarks. Selective authentication embeds two watermarks: one fragile for malicious changes and one robust for allowed transformations. If only benign edits occur, the robust watermark still validates authenticity.",,,[ wm-exactvsselectiveauth ] how doe exact content authentication WATERMARKING differ selective authentication ?,"exact authentication flag change illicit , using fragile watermark . selective authentication embeds watermark : fragile for malicious change and robust for allowed transformation . only benign edits occur , the robust watermark still validates authenticity .",,
[WM-LocalizationRestoration] Explain the process of localization and restoration in content authentication.,Localization identifies which image blocks or pixels are tampered by mapping extracted watermark bits to spatial coordinates. Restoration then replaces or corrects those tampered areas using redundant information—often an auxiliary copy stored within the watermark or side-channel.,,,[ wm-localizationrestoration ] explain process of localization restoration in content authentication .,localization identifies image block or pixel are tampered by mapping extracted watermark bit to spatial coordinate . restoration then replaces or corrects tampered area using redundant information often auxiliary copy stored the watermark or side-channel .,,
[STEG-LSBPalette] Describe LSB steganography in palette-based images and its subtle challenges.,"In palette images, color indices point to a palette entry rather than direct RGB. LSB embedding alters least significant bits of the palette index. However, changing indices may map to semantically different colors, making detection easier if adjacent palette entries differ noticeably.",,,[ steg-lsbpalette ] describe LSB STEGANOGRAPHY in palette-based image subtle challenge .,"in palette image , color index point to a palette entry rather direct RGB . LSB embedding alters least significant bit of the palette index . however , changing index may map to semantically different color , making detection easier adjacent palette entry differ noticeably .",,
[STEG-JStegF5] What are JSteg and F5 steganography methods for JPEGs? Summarize both.,"JSteg embeds by selecting DCT coefficients (non-zero) and replacing their LSB with message bits, but it’s vulnerable to detection since histogram artifacts appear. F5 uses matrix embedding and permutative straddling to reduce changes, embedding more bits with fewer modifications and lowering detectability.",,,[ steg-jstegf5 ] what are jsteg f5 STEGANOGRAPHY method for jpegs ? summarize .,"jsteg embeds by selecting DCT coefficient ( non-zero ) and replacing LSB message bit , but it s vulnerable to detection histogram artifact appear . f5 us matrix embedding and permutative straddling to reduce change , embedding more bit fewer modification and lowering detectability .",,
[STEG-StatisticalDetection] Outline statistical steganalysis as a detection problem,"Statistical steganalysis treats detection as hypothesis testing: H0 (clean cover) vs. H1 (stego). It models cover distributions—e.g., DCT coefficient histograms—and looks for deviations caused by message embedding. Features may be first-order (histogram) or higher-order (co-occurrence matrices)",,,[ steg-statisticaldetection ] outline statistical STEGANALYSIS a detection problem,statistical STEGANALYSIS treat detection hypothesis testing : h0 ( clean cover ) h1 ( stego ) . it model cover distribution e.g . DCT coefficient histogram and look for deviation caused by message embedding . feature may be first-order ( histogram ) or higher-order ( co-occurrence matrix ),,
[STEG-SamplePairF5] Explain sample-pair analysis targeting F5 steganography.,"Sample-pair analysis examines pairs of DCT coefficients; F5’s matrix embedding shifts coefficient values by ±1. By studying the frequencies of specific coefficient pairs before and after embedding, the attack estimates payload and finds evidence of F5 embedding.",,,[ steg-samplepairf5 ] explain sample-pair analysis targeting f5 STEGANOGRAPHY .,"sample-pair analysis examines pair of DCT coefficient ; f5 s matrix embedding shift coefficient value by by studying the frequency of specific coefficient pair and embedding , the attack estimate PAYLOAD and find EVIDENCE of f5 embedding .",,
"[STEG-WetPaperCode] What does “wet paper code” refer to, and why does it help steganography?","In wet paper codes, some carrier bits are “dry” (modifiable) and others “wet” (fixed). The encoder only modifies dry positions known to both parties. This avoids errors when carrier statistics forbid changes in certain locations, enhancing undetectability in adaptive steganography.",,,"[ steg-wetpapercode ] what doe wet paper code refer to , why doe it help STEGANOGRAPHY ?","in wet paper code , CARRIER bit are dry ( modifiable ) and others wet ( fixed ) . the encoder only modifies dry position known to party . avoids error when CARRIER statistic forbid change in certain location , enhancing undetectability in adaptive STEGANOGRAPHY .",,
[STEG-RandomLinearVsHamming] Compare random linear codes and binary Hamming codes for data hiding.,"Random linear codes use large sparse generator matrices to embed high payloads with random parity checks. Binary Hamming codes are small, structured codes that embed fewer bits but with very low distortion due to guaranteed single-bit error correction, trading capacity for minimal change.",,,[ steg-randomlinearvshamming ] compare random linear code binary hamming code for data hiding .,"random linear code use large sparse generator matrix to embed high payload random parity check . binary hamming code are small , structured code embed fewer bit but very low distortion due to guaranteed single-bit error correction , trading CAPACITY for minimal change .",,
[STEG-QaryCodes] Define Q-ary random linear codes and their application to large payloads.,"Q-ary codes operate over larger alphabets instead of binary, grouping multiple bits per symbol. For data hiding, they allow embedding multiple bits in one host coefficient via multi-level quantization, boosting payload capacity while managing distortion.",,,[ steg-qarycodes ] define q-ary random linear code application to large payload .,"q-ary code operate larger alphabet instead of binary , grouping multiple bit symbol . for data hiding , allow embedding multiple bit in host coefficient multi-level quantization , boosting PAYLOAD CAPACITY managing distortion .",,
[STEG-TemporalAudio] Describe temporal-domain audio steganography and one embedding technique.,"Temporal-domain audio steganography embeds data directly into time-domain samples, such as LSB replacement in PCM samples. For example, the least significant bit of each audio sample is replaced with message bits, offering high capacity but low robustness to re-sampling or lossy compression.",,,[ steg-temporalaudio ] describe temporal-domain audio STEGANOGRAPHY embedding technique .,"temporal-domain audio STEGANOGRAPHY embeds data directly time-domain sample , such LSB replacement in pcm sample . for example , the least significant bit of audio sample is replaced message bit , offering high CAPACITY but low ROBUSTNESS to re-sampling or lossy compression .",,
[STEG-TransformAudio] Explain transform-domain audio steganography using DCT or DWT.,"Transform-domain methods convert audio frames into frequency coefficients via DCT or DWT, then embed message bits into selected coefficients (often mid-frequency bands). These embeddings survive common audio compression better and remain imperceptible by avoiding sensitive frequency ranges.",,,[ steg-transformaudio ] explain transform-domain audio STEGANOGRAPHY using DCT or DWT .,"transform-domain method convert audio frame frequency coefficient DCT or DWT , then embed message bit selected coefficient ( often mid-frequency band ) . embeddings survive common audio compression better and remain imperceptible by avoiding sensitive frequency range .",,
[STEG-CepstralAudio] What is cepstral-domain steganography in audio and its advantage?,"Cepstral-domain steganography embeds data in cepstral coefficients (inverse Fourier of log spectrum), leveraging the human ear’s reduced sensitivity to fine spectral variations. It provides robustness against equalization and minor filtering and often yields low perceptual distortion.",,,[ steg-cepstralaudio ] what is cepstral-domain STEGANOGRAPHY in audio advantage ?,"cepstral-domain STEGANOGRAPHY embeds data in cepstral coefficient ( inverse fourier of log spectrum ) , leveraging the human ear s reduced sensitivity to fine spectral variation . it provides ROBUSTNESS equalization and minor filtering and often yield low perceptual distortion .",,
[STEG-SubstitutionVideo] Give an overview of substitution-based video steganography.,"Substitution-based video steganography replaces selected pixel values or motion vectors directly with message bits, frame by frame. While simple, it’s vulnerable to temporal averaging or frame re-encoding; hence, embedding often uses only low-motion or high-texture areas to hide changes.",,,[ steg-substitutionvideo ] give overview of substitution-based video STEGANOGRAPHY .,"substitution-based video STEGANOGRAPHY replaces selected pixel value or motion vector directly message bit , frame by frame . simple , it s vulnerable to temporal averaging or frame re-encoding ; hence , embedding often us only low-motion or high-texture area to hide change .",,
[STEG-TransformVideo] How do transform-domain video techniques embed data in motion vectors?,"In compressed video (e.g., MPEG), motion vectors indicate block displacement. Transform-domain steganography perturbs vector components by small offsets representing message bits. Since motion vectors change less perceptible motion, it stays hidden under normal playback.",,,[ steg-transformvideo ] how do transform-domain video technique embed data in motion vector ?,"in compressed video ( e.g . mpeg ) , motion vector indicate block displacement . transform-domain STEGANOGRAPHY perturbs vector component by small offset representing message bit . motion vector change less perceptible motion , it stay hidden normal playback .",,
[STEG-AdaptiveVideo] Describe adaptive video steganography and why it’s more secure.,"Adaptive schemes analyze scene complexity and choose embedding locations that minimize perceptual impact—e.g., high-motion or textured areas. By matching host statistics, they reduce statistical anomalies and resist both spatial and temporal steganalysis",,,[ steg-adaptivevideo ] describe adaptive video STEGANOGRAPHY why it s more secure .,"adaptive scheme analyze scene complexity and choose embedding location minimize perceptual impact e.g . high-motion or textured area . by matching host statistic , reduce statistical anomaly and resist spatial and temporal STEGANALYSIS",,
[STEG-FormatVideo] What are format-based techniques in video steganography?,"Format-based methods exploit container or codec metadata fields (e.g., SEI in H.264) to store hidden data. Since these fields aren’t used for core decoding, they allow large payloads without altering pixel data; however, they can be stripped by format converters.",,,[ steg-formatvideo ] what are format-based technique in video STEGANOGRAPHY ?,"format-based method exploit container or codec METADATA field ( e.g . sei in h.264 ) to store hidden data . field aren t used for core decoding , allow large payload altering pixel data ; however , can be stripped by format converter .",,
[STEG-CoverGenVideo] Explain cover generation techniques in video data hiding.,"Instead of modifying existing video, cover generation synthesizes a new “cover” sequence embedding the message—e.g., generating P-frames with controlled motion. This yields perfect undetectability relative to modifications but requires substantial computation and careful codec compliance.",,,[ steg-covergenvideo ] explain cover generation technique in video data hiding .,"instead of modifying existing video , cover generation synthesizes a new cover sequence embedding the message e.g . generating p-frames controlled motion . yield perfect undetectability relative to modification but requires substantial computation and careful codec compliance .",,
[WM-VideoQuality] Define video quality metrics used to assess watermark imperceptibility,"Metrics include PSNR (Peak Signal-to-Noise Ratio), SSIM (Structural Similarity Index), and VQM (Video Quality Metric). PSNR quantifies pixel-level distortion, SSIM models human perception of structure, and VQM captures temporal and spatial artifacts, guiding embedding thresholds.",,,[ wm-videoquality ] define video quality metric used to assess watermark imperceptibility,"metric include psnr ( peak signal-to-noise ratio ) , ( structural similarity index ) , and vqm ( video quality metric ) . psnr quantifies pixel-level distortion , ssim model human perception of structure , and vqm capture temporal and spatial artifact , guiding embedding threshold .",,
[WM-Transparency] How is perceptual transparency analyzed in watermark design?,"Perceptual models simulate the human visual system: masking effects, contrast sensitivity, and texture complexity. Embedding strength is planned so that watermark energy stays below just-noticeable-distortion thresholds, ensuring viewers do not perceive artifacts.",,,[ wm-transparency ] how is perceptual transparency analyzed in watermark design ?,"perceptual model simulate the human visual system : masking effect , contrast sensitivity , and texture complexity . embedding strength is planned so watermark energy stay just-noticeable-distortion threshold , ensuring viewer do not perceive artifact .",,
[WM-CompressionRobustness] Discuss robustness against compression in both watermarking and steganography.,"Robust schemes embed in mid-to-low frequencies or motion vectors, which survive lossy codecs. Error-correction coding and spread-spectrum techniques further recover data post-compression. Steganography often uses transform-domain embedding plus noise-resilient coding to maintain secrecy.",,,[ wm-compressionrobustness ] discus ROBUSTNESS compression in WATERMARKING STEGANOGRAPHY .,"robust scheme embed in mid-to-low frequency or motion vector , survive lossy codecs . error-correction coding and spread-spectrum technique further recover data post-compression . STEGANOGRAPHY often us transform-domain embedding noise-resilient coding to maintain secrecy .",,
[WM-AnalyzingErrors] Explain the concept of “analyzing errors” in watermarked signals.,"After extraction, the difference between expected watermark bits and received bits indicates error patterns. Statistical analysis of these errors helps distinguish between benign distortions (e.g., compression noise) and deliberate tampering, adjusting thresholds dynamically.",,,[ wm-analyzingerrors ] explain concept of analyzing error in watermarked signal .,"extraction , the difference expected watermark bit and received bit indicates error pattern . statistical analysis of error help distinguish benign distortion ( e.g . compression noise ) and deliberate tampering , adjusting threshold dynamically .",,
[WM-SecurityReqs] What security requirements apply specifically to watermarking systems?,"Requirements include key secrecy (unique embed/extract keys), unpredictability (watermark sequences appear random), resistance to key-estimation attacks, and provable security models under chosen-plaintext or chosen-ciphertext scenarios.",,,[ wm-securityreqs ] what security requirement apply specifically to WATERMARKING system ?,"requirement include key secrecy ( unique embed/extract key ) , unpredictability ( watermark sequence appear random ) , resistance to key-estimation attack , and provable security model chosen-plaintext or chosen-ciphertext scenario .",,
[WM-CryptoIntegration] How does watermarking integrate with cryptography for enhanced security?,"Cryptographic techniques (e.g., encrypting the watermark payload) prevent adversaries from forging valid watermarks. Hash functions can generate message digests embedded as fragile watermarks, ensuring content integrity via collision‐resistant checks.",,,[ wm-cryptointegration ] how doe WATERMARKING integrate cryptography for enhanced security ?,"cryptographic technique ( e.g . encrypting the watermark PAYLOAD ) prevent adversary forging valid watermark . hash function can generate message digest embedded fragile watermark , ensuring content integrity collision resistant check .",,
[WM-BlockChecksum] Describe a localization technique using block-based checksums.,"The image is divided into non-overlapping blocks; each block’s checksum (e.g., hash) is appended as a watermark bit. During detection, recomputed hashes per block compared to extracted bits pinpoint tampered blocks precisely.",,,[ wm-blockchecksum ] describe a localization technique using block-based checksum .,"the image is divided non-overlapping block ; block s checksum ( e.g . hash ) is appended a watermark bit . detection , recomputed hash block compared to extracted bit pinpoint tampered block precisely .",,
