question,answer,remarks,improvements,question_clean,answer_clean,remarks_clean,improvements_clean
"[Social Engineering] What tactics do attackers use in social engineering, and how can organizations defend against them?","Tactics include pretexting (fake scenarios), baiting (malware-laden USBs), and quid pro quo (“tech support”). Defense requires training, strict verification protocols, and simulated phishing exercises to build user awareness.",,,"[ social engineering ] what tactic do attacker use in social engineering , how can organization defend ?","tactic include pretexting ( fake scenario ) , baiting ( malware-laden usbs ) , and quid ( tech support ) . defense requires training , strict verification protocol , and simulated phishing exercise to build user awareness .",,
"[VPNs] How do VPNs enhance security for remote workers, and what risks remain?","VPNs encrypt traffic between users and corporate networks, shielding data on public Wi-Fi. Risks include VPN vulnerabilities (e.g., outdated protocols) and credential theft. Zero-trust network access (ZTNA) is increasingly replacing traditional VPNs.",,,"[ vpns ] how do vpns enhance security for remote worker , what risk remain ?","vpns encrypt traffic user and corporate network , shielding data on public wi-fi . risk include VPN vulnerability ( e.g . outdated protocol ) and credential theft . zero-trust network access ( ztna ) is increasingly replacing traditional vpns .",,
"[Hashing] How does hashing differ from encryption, and where is it used in security?","Hashing converts data to a fixed-size string (irreversible), used for integrity checks (e.g., verifying file downloads). Encryption is reversible (requires a key), used for confidentiality. Common hashes include SHA-256; encryption uses AES.",,,"[ HASHING ] how doe HASHING differ ENCRYPTION , where is it used in security ?","HASHING convert data to a fixed-size string ( irreversible ) , used for integrity check ( e.g . verifying file downloads ) . ENCRYPTION is reversible ( requires a key ) , used for confidentiality . common hash include sha-256 ; ENCRYPTION us AES .",,
"[Training] Why is security awareness training vital, and what topics should it cover?","Human error causes 85% of breaches. Training should cover phishing, password hygiene, physical security, and reporting procedures. Interactive modules and real-world simulations improve retention and behavior change.",,,"[ training ] why is security awareness training vital , what topic it cover ?","human error cause 85 % of breach . training cover phishing , password hygiene , physical security , and reporting procedure . interactive module and real-world simulation improve retention and behavior change .",,
[Cloud Security] What are the top three cloud security best practices?,"1) Shared Responsibility Model: Know provider vs. user duties. 2) Encryption: Data at rest/in transit. 3) Identity & Access Management (IAM): Least privilege, MFA. Also, monitor for misconfigurations (e.g., exposed S3 buckets).",,,[ cloud security ] what are top cloud security best practice ?,"1 ) shared responsibility model : know provider user duty . 2 ) ENCRYPTION : data at rest/in transit . 3 ) identity access management ( iam ) : least privilege , mfa . also , monitor for misconfigurations ( e.g . exposed s3 bucket ) .",,
[IDS/IPS] Compare IDS and IPS in detecting and preventing threats.,"IDS (Intrusion Detection Systems) monitor and alert on suspicious activity. IPS (Intrusion Prevention Systems) actively block threats (e.g., dropping malicious packets). Both use signature/heuristic analysis but differ in response actions.",,,[ ids/ips ] compare IDS IPS in detecting preventing threat .,IDS ( INTRUSION detection system ) monitor and alert on suspicious activity . IPS ( INTRUSION prevention system ) actively block threat ( e.g . dropping malicious packet ) . use signature/heuristic analysis but differ in response action .,,
[Risk Assessment] Describe the process of conducting a cybersecurity risk assessment.,"1) Identify Assets (data, systems). 2) Threat Modeling (attack vectors). 3) Vulnerability Analysis (weaknesses). 4) Impact/Likelihood Evaluation. 5) Mitigation Planning (controls). Frameworks like NIST SP 800-30 standardize this process.",,,[ risk assessment ] describe process of conducting a cybersecurity risk assessment .,"1 ) identify asset ( data , system ) . 2 ) threat modeling ( attack vector ) . 3 ) vulnerability analysis ( weakness ) . 4 ) impact/likelihood evaluation . 5 ) mitigation planning ( control ) . framework nist sp 800-30 standardize process .",,
"[InfoSec-GRC] What is Governance, Risk, and Compliance (GRC) in information security and why is it important?","GRC is a strategic approach that integrates governance (oversight and policies), risk management (identifying and mitigating threats), and compliance (adhering to laws and standards) to ensure that security practices align with business goals. It helps organizations proactively manage risks, meet regulatory requirements, and foster a culture of accountability.",,,"[ infosec-grc ] what is governance , risk , compliance ( grc ) in information security why is it important ?","grc is a strategic approach integrates governance ( oversight and policy ) , risk management ( identifying and mitigating threat ) , and compliance ( adhering to law and standard ) to ensure security practice align business goal . it help organization proactively manage risk , meet regulatory requirement , and foster a culture of accountability .",,
"[InfoSec-AccessControl] How do discretionary, mandatory, and role-based access control models differ in information security?","Discretionary Access Control (DAC) lets data owners grant access, Mandatory Access Control (MAC) enforces access based on system policies and security labels, and Role-Based Access Control (RBAC) assigns permissions based on user roles. RBAC is widely used for its scalability and ease of management.",,,"[ infosec-accesscontrol ] how do discretionary , mandatory , role-based access control model differ in information security ?","discretionary access control ( dac ) let data owner grant access , mandatory access control ( MAC ) enforces access based on system policy and security label , and role-based access control ( rbac ) assigns permission based on user role . rbac is widely used for scalability and ease of management .",,
"[InfoSec-InsiderThreat] What are insider threats in information security, and how can organizations detect and prevent them?","Insider threats involve malicious or careless actions by employees or trusted partners that compromise data or systems. Detection includes monitoring user behavior and using DLP tools, while prevention relies on strong access controls, least privilege, and regular security awareness training.",,,"[ infosec-insiderthreat ] what are insider threat in information security , how can organization detect prevent ?","insider threat involve malicious or careless action by employee or trusted partner compromise data or system . detection includes monitoring user behavior and using dlp tool , prevention relies on strong access control , least privilege , and regular security awareness training .",,
"[InfoSec-PhysicalSecurity] Why is physical security a critical component of information security, and what controls are commonly used?","Physical security protects IT assets from theft, tampering, or disaster. Controls include secure facility access (badges, biometrics), surveillance cameras, locked server rooms, and environmental safeguards like fire suppression and climate control, complementing technical controls for holistic protection.",,,"[ infosec-physicalsecurity ] why is physical security a critical component of information security , what control are commonly used ?","physical security protects it asset theft , tampering , or disaster . control include secure facility access ( badge , biometrics ) , surveillance camera , locked server room , and environmental safeguard fire suppression and climate control , complementing technical control for holistic protection .",,
"[InfoSec-Backup] How do regular backups contribute to information security, and what are best practices for backup management?","Regular backups ensure data can be restored after incidents like ransomware or hardware failure. Best practices include automated, frequent backups, offsite or cloud storage, encryption, periodic restore testing, and retention policies that balance recovery needs with storage costs.",,,"[ infosec-backup ] how do regular backup contribute to information security , what are best practice for backup management ?","regular backup ensure data can be restored incident RANSOMWARE or hardware failure . best practice include automated , frequent backup , offsite or cloud storage , ENCRYPTION , periodic restore testing , and retention policy balance recovery need storage cost .",,
[InfoSec-DataClassification] What is data classification and how does it support information security?,"Data classification categorizes information by sensitivity and value (e.g., public, confidential, restricted), guiding the application of appropriate security controls such as encryption or access restrictions and helping organizations comply with regulations.",,,[ infosec-dataclassification ] what is data classification how doe it support information security ?,"data classification categorizes information by sensitivity and value ( e.g . public , confidential , restricted ) , guiding the application of appropriate security control such ENCRYPTION or access restriction and helping organization comply regulation .",,
[InfoSec-IDSvsIPS] How do Intrusion Detection Systems (IDS) and Intrusion Prevention Systems (IPS) differ in their approach to network security?,"IDS monitors network traffic for suspicious activity and alerts administrators, while IPS actively blocks or mitigates detected threats in real time. IDS is passive and used for detection and analysis; IPS is proactive and stops attacks before they reach their targets.",,,[ infosec-idsvsips ] how do INTRUSION detection system ( IDS ) INTRUSION prevention system ( IPS ) differ in approach to network security ?,"IDS monitor network traffic for suspicious activity and alert administrator , IPS actively block or mitigates detected threat in real time . IDS is passive and used for detection and analysis ; IPS is proactive and stop attack reach target .",,
[InfoSec-PrivEsc] What is privilege escalation and how can organizations defend against it?,"Privilege escalation occurs when an attacker gains higher access rights than intended, often by exploiting software flaws or misconfigurations. Defenses include regular patching, enforcing least privilege, monitoring for unusual account activity, and promptly removing unnecessary admin rights.",,,[ infosec-privesc ] what is privilege escalation how can organization defend it ?,"privilege escalation occurs when attacker gain higher access right intended , often by exploiting software flaw or misconfigurations . defense include regular patching , enforcing least privilege , monitoring for unusual account activity , and promptly removing unnecessary admin right .",,
"[InfoSec-RemoteWork] What security challenges arise from remote work, and how can organizations mitigate them?","Remote work increases risks such as unsecured home networks and phishing attacks. Mitigation includes enforcing VPN use, multi-factor authentication, endpoint security solutions, regular security training, and clear remote work policies to ensure secure access to company resources.",,,"[ infosec-remotework ] what security challenge arise remote work , how can organization mitigate ?","remote work increase risk such unsecured home network and phishing attack . mitigation includes enforcing VPN use , multi-factor authentication , endpoint security solution , regular security training , and clear remote work policy to ensure secure access to company resource .",,
"[InfoSec-Logging] Why is centralized logging important for information security, and what should be logged?","Centralized logging aggregates security-relevant events from across the organization, enabling efficient monitoring, incident detection, and forensic analysis. Logs should include authentication attempts, access to sensitive data, system changes, and network activity, and must be protected from tampering.",,,"[ infosec-logging ] why is centralized logging important for information security , what be logged ?","centralized logging aggregate security-relevant event the organization , enabling efficient monitoring , incident detection , and forensic analysis . log include authentication attempt , access to sensitive data , system change , and network activity , and be protected tampering .",,
"[InfoSec-BYOD] What are the risks of Bring Your Own Device (BYOD) policies, and how can they be managed securely?","BYOD introduces risks like data leakage and malware. Secure management involves enforcing device encryption, remote wipe capabilities, strong authentication, mobile device management (MDM) solutions, and clear policies on acceptable use and corporate data access.",,,"[ infosec-byod ] what are risk of bring own device ( byod ) policy , how can be managed securely ?","byod introduces risk data leakage and malware . secure management involves enforcing device ENCRYPTION , remote wipe capability , strong authentication , mobile device management ( mdm ) solution , and clear policy on acceptable use and corporate data access .",,
[InfoSec-Redundancy] How does redundancy improve information security and business continuity?,"Redundancy duplicates critical systems, data, and network paths to ensure availability in case of failure or attack. It supports business continuity by minimizing downtime, enabling rapid recovery, and providing failover capabilities for mission-critical applications.",,,[ infosec-redundancy ] how doe redundancy improve information security business continuity ?,"redundancy duplicate critical system , data , and network path to ensure availability in case of failure or attack . it support business continuity by minimizing downtime , enabling rapid recovery , and providing failover capability for mission-critical application .",,
"[InfoSec-ThirdParty] What information security risks are associated with third-party vendors, and how can organizations mitigate them?","Third-party vendors can introduce vulnerabilities through insecure software or poor practices. Risk mitigation includes vendor risk assessments, contractual security requirements, monitoring vendor access, and regularly reviewing third-party security postures.",,,"[ infosec-thirdparty ] what information security risk are associated third-party vendor , how can organization mitigate ?","third-party vendor can introduce vulnerability insecure software or poor practice . risk mitigation includes vendor risk assessment , contractual security requirement , monitoring vendor access , and regularly reviewing third-party security posture .",,
"[InfoSec-DataRetention] Why are data retention policies important in information security, and what factors influence them?","Data retention policies define how long information is stored and when it is deleted. They help organizations comply with legal and business requirements, minimize data breach exposure, and manage storage costs, influenced by data sensitivity, regulations, and business needs.",,,"[ infosec-dataretention ] why are data retention policy important in information security , what factor influence ?","data retention policy define how long information is stored and when it is deleted . help organization comply legal and business requirement , minimize data breach exposure , and manage storage cost , influenced by data sensitivity , regulation , and business need .",,
[InfoSec-PasswordMgmt] What are best practices for password management in organizations?,"Enforce strong, unique passwords, regular password changes, use password managers, implement multi-factor authentication, and educate users on phishing and reuse risks. Password policies should balance security with usability to encourage compliance.",,,[ infosec-passwordmgmt ] what are best practice for password management in organization ?,"enforce strong , unique password , regular password change , use password manager , implement multi-factor authentication , and educate user on phishing and reuse risk . password policy balance security usability to encourage compliance .",,
[InfoSec-EndpointSecurity] How do endpoint security solutions protect organizational assets?,"Endpoint security solutions (antivirus, anti-malware, EDR) protect devices from threats by monitoring for malicious activity, enforcing security policies, and providing rapid response to incidents, forming a critical layer of defense for laptops, smartphones, and other endpoints.",,,[ infosec-endpointsecurity ] how do security solution protect organizational asset ?,"endpoint security solution ( antivirus , anti-malware , edr ) protect device threat by monitoring for malicious activity , enforcing security policy , and providing rapid response to incident , forming a critical layer of defense for laptop , smartphones , and other endpoint .",,
"[InfoSec-DataMinimization] What is data minimization, and how does it enhance information security?","Data minimization means collecting and retaining only necessary data, reducing the volume of sensitive information at risk. It limits exposure in case of breaches, simplifies compliance, and supports privacy by design principles.",,,"[ infosec-dataminimization ] what is data minimization , how doe it enhance information security ?","data minimization mean collecting and retaining only necessary data , reducing the volume of sensitive information at risk . it limit exposure in case of breach , simplifies compliance , and support privacy by design principle .",,
[InfoSec-CloudSecurity] What are the main security considerations when migrating to cloud services?,"Key considerations include understanding the shared responsibility model, encrypting data at rest and in transit, managing access controls, monitoring for misconfigurations, and ensuring compliance with regulations. Regular security assessments and strong vendor management are also essential.",,,[ infosec-cloudsecurity ] what are main security consideration when migrating to cloud service ?,"key consideration include understanding the shared responsibility model , encrypting data at REST and in transit , managing access control , monitoring for misconfigurations , and ensuring compliance regulation . regular security assessment and strong vendor management are also essential .",,
[InfoSec-SOC] What is a Security Operations Center (SOC) and how does it support organizational security?,"A SOC is a centralized team that monitors, detects, analyzes, and responds to security incidents using specialized tools and processes. It provides continuous surveillance, threat intelligence, and incident response, helping organizations maintain a proactive security posture.",,,[ infosec-soc ] what is a security operation center ( soc ) how doe it support organizational security ?,"a soc is a centralized team monitor , detects , analyzes , and responds to security incident using specialized tool and process . it provides continuous surveillance , threat intelligence , and incident response , helping organization maintain a proactive security posture .",,
[InfoSec-UserAwareness] Why is user awareness training a cornerstone of information security programs?,"Human error is a leading cause of breaches. User awareness training educates employees about threats like phishing and secure data handling. Regular, engaging training empowers users to recognize and report suspicious activity, significantly reducing organizational risk.",,,[ infosec-userawareness ] why is user awareness training a cornerstone of information security program ?,"human error is a leading cause of breach . user awareness training educates employee threat phishing and secure data handling . regular , engaging training empowers user to recognize and report suspicious activity , significantly reducing organizational risk .",,
"[Zero Trust] What is Zero Trust Architecture (ZTA), and how does it enhance modern information security strategies?","Zero Trust Architecture (ZTA) operates on the principle of ""never trust, always verify,"" requiring continuous authentication and authorization for all users, devices, and applications—regardless of their location. Unlike traditional perimeter-based security, ZTA employs micro-segmentation to isolate network resources, least-privilege access controls, and real-time monitoring. Key components include multi-factor authentication (MFA), encryption, and Software-Defined Perimeter (SDP) technologies. By assuming breaches are inevitable, ZTA minimizes lateral movement and reduces attack surfaces, making it critical for hybrid cloud environments and remote workforces.",,,"[ trust ] what is trust architecture ( zta ) , how doe it enhance modern information security strategy ?","zero trust architecture ( zta ) operates on the principle of never trust , always verify , requiring continuous authentication and authorization for user , device , and application regardless of location . traditional perimeter-based security , zta employ micro-segmentation to isolate network resource , least-privilege access control , and real-time monitoring . key component include multi-factor authentication ( mfa ) , ENCRYPTION , and software-defined perimeter ( sdp ) technology . by assuming breach are inevitable , zta minimizes lateral movement and reduces attack surface , making it critical for hybrid cloud environment and remote workforce .",,
"[GDPR] How does the General Data Protection Regulation (GDPR) impact global organizations, and what are its core requirements?","GDPR mandates strict data protection and privacy standards for organizations handling EU citizens' data, regardless of their location. Core requirements include obtaining explicit consent for data collection, enabling the ""right to be forgotten,"" appointing Data Protection Officers (DPOs), and reporting breaches within 72 hours. Non-compliance can result in fines up to 4% of global revenue. Organizations must implement encryption, pseudonymization, and Data Protection Impact Assessments (DPIAs) to align with GDPR, fostering transparency and accountability in data handling.",,,"[ GDPR ] how doe general data protection regulation ( GDPR ) impact global organization , what are core requirement ?","GDPR mandate strict data protection and privacy standard for organization handling eu citizen data , regardless of location . core requirement include obtaining explicit CONSENT for data collection , enabling the right to be forgotten , appointing data protection officer ( dpos ) , and reporting breach 72 hour . non-compliance can result in fine up to 4 % of global revenue . organization implement ENCRYPTION , PSEUDONYMIZATION , and data protection impact assessment ( dpias ) to align GDPR , fostering transparency and accountability in data handling .",,
"[Ransomware] How do modern ransomware attacks bypass traditional defenses, and what layered mitigations are most effective?","Modern ransomware uses advanced tactics like polymorphic code (evading signature-based detection), phishing with malicious macros, and exploiting unpatched vulnerabilities (e.g., ProxyLogon). Layered defenses include:",,,"[ RANSOMWARE ] how do modern RANSOMWARE attack bypass traditional defense , what layered mitigation are most effective ?","modern RANSOMWARE us advanced tactic polymorphic code ( evading signature-based detection ) , phishing malicious macro , and exploiting unpatched vulnerability ( e.g . proxylogon ) . layered defense include :",,
"[Threat Intel] What is threat intelligence, and how do organizations operationalize it to improve security postures?","Threat intelligence involves collecting, analyzing, and acting on data about emerging threats (e.g., Indicators of Compromise, TTPs). Organizations use platforms like MISP or commercial feeds to integrate intelligence into SIEMs, firewalls, and EDR systems. Operationalizing it involves:",,,"[ threat intel ] what is threat intelligence , how do organization operationalize it to improve security posture ?","threat intelligence involves collecting , analyzing , and acting on data emerging threat ( e.g . indicator of compromise , ttps ) . organization use platform misp or commercial feed to integrate intelligence siems , firewall , and edr system . operationalizing it involves :",,
"[APTs] What are Advanced Persistent Threats (APTs), and how do they differ from typical cyberattacks?","APTs are prolonged, targeted attacks by nation-states or organized groups aiming to steal data or disrupt operations. Unlike ""smash-and-grab"" attacks, APTs use stealthy techniques like supply chain compromises, zero-day exploits, and living-off-the-land binaries (e.g., PowerShell). Defense requires network traffic analysis, user behavior analytics (UEBA), and deception technologies (e.g., honeypots) to detect lateral movement and command-and-control (C2) activity.",,,"[ apts ] what are advanced persistent threat ( apts ) , how do differ typical cyberattacks ?","apts are prolonged , targeted attack by nation-states or organized group aiming to steal data or disrupt operation . smash-and-grab attack , apts use stealthy technique supply chain compromise , ZERO-DAY exploit , and living-off-the-land binary ( e.g . powershell ) . defense requires network traffic analysis , user behavior analytics ( ueba ) , and deception technology ( e.g . honeypot ) to detect lateral movement and command-and-control ( c2 ) activity .",,
