question,answer,remarks,improvements,question_clean,answer_clean,remarks_clean,improvements_clean
"[Malware-ReverseEngineering] What is reverse engineering in malware analysis, and why is it a critical skill for advanced analysts?","Reverse engineering involves deconstructing malware binaries to understand their logic, algorithms, and intent. Using tools like IDA Pro, Ghidra, or Radare2, analysts disassemble or decompile code to reconstruct higher-level operations, identify encryption routines, extract hardcoded indicators, and discover vulnerabilities or exploits used by the malware. This skill is critical for creating custom detection signatures, developing countermeasures, and attributing attacks to specific threat actors. It also enables analysts to understand novel or highly obfuscated malware that cannot be fully analyzed through automated tools alone.",,,"[ malware-reverseengineering ] what is reverse engineering in malware analysis , why is it a critical skill for advanced analyst ?","reverse engineering involves deconstructing malware binary to understand logic , algorithm , and intent . using tool IDA , GHIDRA , or radare2 , analyst disassemble or decompile code to reconstruct higher-level operation , identify ENCRYPTION routine , extract hardcoded indicator , and discover vulnerability or exploit used by the malware . skill is critical for creating custom detection signature , developing countermeasure , and attributing attack to specific threat actor . it also enables analyst to understand novel or highly obfuscated malware can not be fully analyzed automated tool alone .",,
"[Malware-Obfuscation] How do malware authors use obfuscation techniques, and what challenges do these pose for analysis?","Malware authors employ obfuscation techniques such as code packing, encryption, control flow flattening, and junk code insertion to disguise the true purpose of their programs. These methods make static analysis difficult by hiding malicious payloads, altering code structure, or dynamically generating code at runtime. Obfuscation challenges analysts by increasing the time and expertise required to unpack or deobfuscate samples, often necessitating advanced reverse engineering or memory forensics to reveal the malware’s actual behavior and intent.",,,"[ malware-obfuscation ] how do malware author use OBFUSCATION technique , what challenge do pose for analysis ?","malware author employ OBFUSCATION technique such code packing , ENCRYPTION , control flow flattening , and junk code insertion to disguise the true purpose of program . method make STATIC analysis difficult by hiding malicious payload , altering code structure , or dynamically generating code at runtime . OBFUSCATION challenge analyst by increasing the time and expertise required to unpack or deobfuscate sample , often necessitating advanced reverse engineering or memory forensics to reveal the malware s actual behavior and intent .",,
"[Malware-SandboxEvasion] What are sandbox evasion techniques, and how can analysts detect or counter them?","Sandbox evasion techniques are methods used by malware to detect when it is running in an automated analysis environment and alter its behavior to avoid detection. Common tactics include checking for virtual machine artifacts, delaying execution, requiring user interaction, or detecting the absence of certain files or processes. Analysts can counter these by using more realistic sandbox configurations, instrumenting sandboxes to simulate user activity, and employing hybrid analysis that combines static and dynamic methods to catch evasive behaviors.",,,"[ malware-sandboxevasion ] what are SANDBOX evasion technique , how can analyst detect or counter ?","SANDBOX evasion technique are method used by malware to detect when it is running in automated analysis environment and alter behavior to avoid detection . common tactic include checking for virtual machine artifact , delaying execution , requiring user interaction , or detecting the absence of certain file or process . analyst can counter by using more realistic SANDBOX configuration , instrumenting sandbox to simulate user activity , and employing hybrid analysis combine STATIC and DYNAMIC method to catch evasive behavior .",,
"[Malware-Indicators] What are Indicators of Compromise (IOCs) in malware analysis, and how are they used in threat detection?","Indicators of Compromise (IOCs) are forensic artifacts—such as file hashes, IP addresses, domain names, registry keys, or mutexes—left by malware during infection. Analysts extract IOCs from malware samples and use them to create detection signatures, inform intrusion detection systems, and share threat intelligence across organizations. Timely identification and dissemination of IOCs enable rapid detection and blocking of ongoing or future attacks, but analysts must also watch for false positives and regularly update IOCs as malware evolves.",,,"[ malware-indicators ] what are indicator of compromise ( iocs ) in malware analysis , how are used in threat detection ?","indicator of compromise ( iocs ) are forensic artifact such file hash , IP address , domain name , registry key , or mutexes left by malware infection . analyst extract iocs malware sample and use to create detection signature , inform INTRUSION detection system , and share threat intelligence organization . timely identification and dissemination of iocs enable rapid detection and blocking of ongoing or future attack , but analyst also watch for false positive and regularly update iocs malware evolves .",,
"[Malware-FamilyClassification] How do analysts classify malware into families, and why is this important for defense?","Malware family classification involves grouping malware samples based on shared code, behavior, or origin. Analysts use static and dynamic features—such as code signatures, network patterns, or payload similarities—to assign samples to known families like Emotet, TrickBot, or WannaCry. Classification is important because it allows defenders to understand the capabilities, typical targets, and evolution of threats, enabling more effective detection, response, and attribution to specific threat actors or campaigns.",,,"[ malware-familyclassification ] how do analyst classify malware family , why is important for defense ?","malware family classification involves grouping malware sample based on shared code , behavior , or origin . analyst use STATIC and DYNAMIC feature such code signature , network pattern , or PAYLOAD similarity to assign sample to known family emotet , trickbot , or wannacry . classification is important it allows defender to understand the capability , typical target , and evolution of threat , enabling more effective detection , response , and attribution to specific threat actor or campaign .",,
"[Malware-Polymorphism] What is polymorphic malware, and how does it evade traditional detection mechanisms?","Polymorphic malware changes its code structure, appearance, or encryption keys with each infection or execution, using mutation engines to generate unique variants. While the core functionality remains the same, the altered code allows it to evade signature-based antivirus solutions, which rely on static patterns. Detection of polymorphic malware often requires behavioral analysis, heuristic scanning, and machine learning approaches that focus on actions rather than code signatures.",,,"[ malware-polymorphism ] what is polymorphic malware , how doe it evade traditional detection mechanism ?","polymorphic malware change code structure , appearance , or ENCRYPTION key infection or execution , using mutation engine to generate unique variant . the core functionality remains the same , the altered code allows it to evade signature-based antivirus solution , rely on STATIC pattern . detection of polymorphic malware often requires BEHAVIORAL analysis , heuristic scanning , and machine learning approach focus on action rather code signature .",,
"[Malware-Metamorphism] How does metamorphic malware differ from polymorphic malware, and what makes it particularly challenging to analyze?","Metamorphic malware rewrites its entire code with each iteration, using techniques like code transposition, instruction substitution, and control flow modification to produce functionally identical but syntactically different samples. Unlike polymorphic malware, which primarily changes encryption or obfuscation layers, metamorphic malware can completely alter its appearance, making static signature detection and even some behavioral analysis much more challenging. Deep code analysis and advanced machine learning are often required to detect such threats.",,,"[ malware-metamorphism ] how doe metamorphic malware differ polymorphic malware , what make it particularly challenging to analyze ?","metamorphic malware rewrite entire code iteration , using technique code transposition , instruction substitution , and control flow modification to produce functionally identical but syntactically different sample . polymorphic malware , primarily change ENCRYPTION or OBFUSCATION layer , metamorphic malware can completely alter appearance , making STATIC SIGNATURE detection and even BEHAVIORAL analysis much more challenging . deep code analysis and advanced machine learning are often required to detect such threat .",,
"[Malware-Rootkit] What is a rootkit, and how does it maintain persistence and stealth on compromised systems?","A rootkit is a type of malware designed to gain and maintain privileged access to a system while hiding its presence from users and security tools. It achieves stealth by modifying operating system components, intercepting system calls, or installing itself in the bootloader or firmware. Rootkits often disable security software, hide files and processes, and provide remote access for attackers, making them difficult to detect and remove. Kernel-level rootkits are particularly insidious, as they operate at the same privilege level as the operating system itself.",,,"[ malware-rootkit ] what is a ROOTKIT , how doe it maintain persistence stealth on compromised system ?","a ROOTKIT is a type of malware designed to gain and maintain privileged access to a system hiding presence user and security tool . it achieves stealth by modifying operating system component , intercepting system call , or installing in the bootloader or firmware . rootkits often disable security software , hide file and process , and provide remote access for attacker , making difficult to detect and remove . kernel-level rootkits are particularly insidious , operate at the same privilege level the operating system .",,
[Malware-MemoryForensics] How does memory forensics aid in the detection and analysis of advanced malware?,"Memory forensics involves capturing and analyzing the volatile memory (RAM) of a system to uncover hidden or running malware that may not be present on disk. Analysts use tools like Volatility or Rekall to examine running processes, injected code, network connections, and encryption keys. Memory analysis is crucial for detecting fileless malware, rootkits, and in-memory payloads that evade traditional disk-based detection methods, providing a deeper understanding of active threats and their techniques.",,,[ malware-memoryforensics ] how doe memory forensics aid in detection analysis of advanced malware ?,"memory forensics involves capturing and analyzing the volatile memory ( RAM ) of a system to uncover hidden or running malware may not be present on disk . analyst use tool VOLATILITY or rekall to examine running process , injected code , network connection , and ENCRYPTION key . memory analysis is crucial for detecting fileless malware , rootkits , and in-memory payload evade traditional disk-based detection method , providing a deeper understanding of active threat and technique .",,
"[Malware-CommandControl] What is a command-and-control (C2) infrastructure, and how do analysts identify and disrupt it?","Command-and-control (C2) infrastructure refers to the servers and protocols used by attackers to remotely control infected machines, exfiltrate data, or deliver additional payloads. Analysts identify C2 channels by monitoring network traffic for suspicious domains, unusual protocols, or beaconing patterns. Disrupting C2 infrastructure involves blocking malicious domains, sinkholing traffic, and collaborating with ISPs or law enforcement to take down servers, which can cripple ongoing campaigns and prevent further compromise.",,,"[ malware-commandcontrol ] what is a command-and-control ( c2 ) infrastructure , how do analyst identify disrupt it ?","command-and-control ( c2 ) infrastructure refers to the server and protocol used by attacker to remotely control infected machine , exfiltrate data , or deliver additional payload . analyst identify c2 channel by monitoring network traffic for suspicious domain , unusual protocol , or beaconing pattern . disrupting c2 infrastructure involves blocking malicious domain , sinkholing traffic , and collaborating isps or law enforcement to take server , can cripple ongoing campaign and prevent further compromise .",,
"[Malware-Persistence] What methods do malware use to achieve persistence on infected systems, and how can defenders counter them?","Malware achieves persistence by modifying system settings to ensure it runs after reboot, such as creating registry run keys, installing scheduled tasks, abusing startup folders, or injecting code into legitimate processes. More advanced threats may use bootkits or firmware implants. Defenders can counter persistence by monitoring for unauthorized changes to startup locations, using application whitelisting, and employing endpoint detection and response (EDR) tools that track process creation and system modifications.",,,"[ malware-persistence ] what method do malware use to achieve persistence on infected system , how can defender counter ?","malware achieves persistence by modifying system setting to ensure it run reboot , such creating registry run key , installing scheduled task , abusing startup folder , or injecting code legitimate process . more advanced threat may use bootkits or firmware implant . defender can counter persistence by monitoring for unauthorized change to startup location , using application whitelisting , and employing endpoint detection and response ( edr ) tool track process creation and system modification .",,
[Malware-BehavioralAnalysis] How does behavioral analysis improve the detection of unknown or zero-day malware?,"Behavioral analysis monitors the actions of programs in real time, such as file creation, registry modifications, network activity, and process spawning, to identify suspicious or malicious patterns. Unlike signature-based detection, which relies on known patterns, behavioral analysis can detect previously unseen or zero-day malware based on its effects and tactics. This approach is increasingly enhanced by machine learning, which can identify subtle anomalies and adapt to evolving threats.",,,[ malware-behavioralanalysis ] how doe BEHAVIORAL analysis improve detection of unknown or ZERO-DAY malware ?,"BEHAVIORAL analysis monitor the action of program in real time , such file creation , registry modification , network activity , and process spawning , to identify suspicious or malicious pattern . signature-based detection , relies on known pattern , BEHAVIORAL analysis can detect previously unseen or ZERO-DAY malware based on effect and tactic . approach is increasingly enhanced by machine learning , can identify subtle anomaly and adapt to evolving threat .",,
"[Malware-Fileless] What is fileless malware, and why is it difficult to detect and remediate?","Fileless malware operates entirely in memory, leveraging legitimate system tools (like PowerShell or WMI) and exploiting vulnerabilities to avoid writing files to disk. This makes it invisible to traditional antivirus solutions that scan for malicious files. Detection requires advanced endpoint monitoring, memory analysis, and behavioral analytics. Remediation is challenging because the malware disappears upon reboot, and attackers often use living-off-the-land techniques to blend in with normal system activity.",,,"[ malware-fileless ] what is fileless malware , why is it difficult to detect remediate ?","fileless malware operates entirely in memory , leveraging legitimate system tool ( powershell or wmi ) and exploiting vulnerability to avoid writing file to disk . make it invisible to traditional antivirus solution scan for malicious file . detection requires advanced endpoint monitoring , memory analysis , and BEHAVIORAL analytics . remediation is challenging the malware disappears reboot , and attacker often use living-off-the-land technique to blend in normal system activity .",,
"[Malware-Malvertising] How does malvertising deliver malware, and what defenses are effective against it?","Malvertising involves injecting malicious ads into legitimate advertising networks, which then appear on trusted websites. Unsuspecting users can be redirected to exploit kits or have malware delivered via drive-by downloads without any user interaction. Effective defenses include using ad blockers, keeping browsers and plugins updated, employing endpoint security solutions with web filtering, and monitoring network traffic for connections to known malicious ad domains.",,,"[ malware-malvertising ] how doe malvertising deliver malware , what defense are effective it ?","malvertising involves injecting malicious ad legitimate advertising network , then appear on trusted website . unsuspecting user can be redirected to exploit kit or have malware delivered drive-by downloads user interaction . effective defense include using ad blocker , keeping browser and plugins updated , employing endpoint security solution web filtering , and monitoring network traffic for connection to known malicious ad domain .",,
"[Malware-APT] What distinguishes Advanced Persistent Threats (APTs) from typical malware campaigns, and how are they analyzed?","APTs are characterized by their stealth, sophistication, and long-term objectives, often targeting specific organizations or industries for espionage or sabotage. They use custom malware, zero-day exploits, and multi-stage attacks, maintaining persistence through lateral movement and privilege escalation. Analysis of APTs involves correlating multiple artifacts, understanding attacker tactics, techniques, and procedures (TTPs), and often requires collaboration across organizations and intelligence sharing to fully uncover the scope and intent of the campaign.",,,"[ malware-apt ] what distinguishes advanced persistent threat ( apts ) typical malware campaign , how are analyzed ?","apts are characterized by stealth , sophistication , and long-term objective , often targeting specific organization or industry for espionage or sabotage . use custom malware , ZERO-DAY exploit , and multi-stage attack , maintaining persistence lateral movement and privilege escalation . analysis of apts involves correlating multiple artifact , understanding attacker tactic , technique , and procedure ( ttps ) , and often requires collaboration organization and intelligence sharing to fully uncover the scope and intent of the campaign .",,
"[Malware-AntiAnalysis] What anti-analysis techniques do modern malware employ, and how can analysts bypass them?","Modern malware uses anti-analysis techniques such as detecting debuggers, checking for virtualized environments, encrypting payloads, and employing code obfuscation or self-modifying code. Analysts can bypass these by using stealthy or customized analysis environments, patching malware binaries to disable checks, leveraging hardware-assisted virtualization, and employing dynamic instrumentation tools that intercept and manipulate malware behavior during execution.",,,"[ malware-antianalysis ] what anti-analysis technique do modern malware employ , how can analyst bypass ?","modern malware us anti-analysis technique such detecting debugger , checking for virtualized environment , encrypting payload , and employing code OBFUSCATION or self-modifying code . analyst can bypass by using stealthy or customized analysis environment , patching malware binary to disable check , leveraging hardware-assisted virtualization , and employing DYNAMIC instrumentation tool intercept and manipulate malware behavior execution .",,
"[Malware-YARA] How are YARA rules used in malware analysis, and what makes them effective for threat hunting?","YARA rules are pattern-matching rules used to identify and classify malware based on strings, byte patterns, or behavioral characteristics. Analysts write YARA rules to detect specific malware families, obfuscation techniques, or indicators of compromise across files, memory dumps, or network traffic. Their flexibility and expressiveness make YARA an essential tool for threat hunting, enabling rapid identification of both known and novel threats across large datasets or enterprise environments.",,,"[ malware-yara ] how are yara rule used in malware analysis , what make effective for threat hunting ?","yara rule are pattern-matching rule used to identify and classify malware based on string , byte pattern , or BEHAVIORAL characteristic . analyst write yara rule to detect specific malware family , OBFUSCATION technique , or indicator of compromise file , memory dump , or network traffic . flexibility and expressiveness make yara essential tool for threat hunting , enabling rapid identification of known and novel threat large datasets or enterprise environment .",,
"[Malware-Triage] What is malware triage, and how does it prioritize analysis efforts during an incident?","Malware triage is the rapid initial assessment of a suspicious file or sample to determine its threat level and urgency. Analysts use automated tools like VirusTotal, Cuckoo Sandbox, or CAPE to generate quick reports on hashes, embedded strings, and basic behavioral indicators. Triage helps prioritize high-risk samples (e.g., ransomware, zero-days) for deeper analysis while filtering out low-risk or known benign files. This process is critical during active breaches to allocate resources efficiently and mitigate damage.",,,"[ malware-triage ] what is malware triage , how doe it prioritize analysis effort incident ?","malware triage is the rapid initial assessment of a suspicious file or sample to determine threat level and urgency . analyst use automated tool VIRUSTOTAL , cuckoo SANDBOX , or cape to generate quick report on hash , embedded string , and basic BEHAVIORAL indicator . triage help prioritize high-risk sample ( e.g . RANSOMWARE , zero-days ) for deeper analysis filtering low-risk or known benign file . process is critical active breach to allocate resource efficiently and mitigate damage .",,
"[Malware-Strings] How do analysts use string extraction in static analysis, and what can hidden strings reveal about malware functionality?","Analysts use tools like strings or FLOSS to extract human-readable text from malware binaries. Hidden strings may reveal hardcoded URLs, API calls, encryption keys, or commands (e.g., cmd.exe /c). Obfuscated strings (e.g., base64, XOR-encoded) often indicate C2 communication or payload retrieval. Even in packed samples, residual strings in memory or decrypted buffers can provide critical IOCs for detection rules.",,,"[ malware-strings ] how do analyst use string extraction in STATIC analysis , what can hidden string reveal malware functionality ?","analyst use tool string or FLOSS to extract human-readable text malware binary . hidden string may reveal hardcoded url , API call , ENCRYPTION , or command ( e.g . cmd.exe /c ) . obfuscated string ( e.g . base64 , xor-encoded ) often indicate c2 communication or PAYLOAD retrieval . even in packed sample , residual string in memory or decrypted buffer can provide critical iocs for detection rule .",,
"[Malware-Unpacking] What techniques are used to unpack encrypted or compressed malware, and why is this critical for analysis?","Unpacking involves extracting the original payload from malware protected by packers like UPX or custom obfuscation. Analysts use debuggers (x64dbg), memory dumpers (Scylla), or automated tools (Unipacker) to pause execution during unpacking and extract the decrypted code. Manual unpacking may require tracing the Original Entry Point (OEP) and patching the Import Address Table (IAT). Failure to unpack prevents analysts from understanding the malware’s core logic and evasion tactics.",,,"[ malware-unpacking ] what technique are used to unpack encrypted or compressed malware , why is critical for analysis ?","unpacking involves extracting the original PAYLOAD malware protected by packer upx or custom OBFUSCATION . analyst use debugger ( x64dbg ) , memory dumper ( scylla ) , or automated tool ( unipacker ) to pause execution unpacking and extract the decrypted code . manual unpacking may require tracing the original entry point ( oep ) and patching the import address table ( iat ) . failure to unpack prevents analyst understanding the malware s core logic and evasion tactic .",,
