question,answer,remarks,improvements,question_clean,answer_clean,remarks_clean,improvements_clean
[Session Management] What are common session management flaws and their impact on web application security?,"Poor session management, such as predictable session IDs, lack of session expiration, or insecure storage, can lead to session hijacking or fixation attacks. These flaws allow attackers to impersonate legitimate users. Implementing secure cookies, regenerating session IDs upon login, using HTTPS, and enforcing idle and absolute session timeouts are essential measures to protect user sessions.",,,[ session management ] what are common session management flaw impact on web application security ?,"poor session management , such predictable session IDS , lack of session expiration , or insecure storage , can lead to session hijacking or fixation attack . flaw allow attacker to impersonate legitimate user . implementing secure cooky , regenerating session IDS login , using HTTPS , and enforcing idle and absolute session timeouts are essential measure to protect user session .",,
"[CSRF] What is Cross-Site Request Forgery (CSRF), and how can developers mitigate it?","Cross-Site Request Forgery (CSRF) tricks authenticated users into submitting unintended requests to a web application, exploiting the trust the app has in the user's browser. Mitigation strategies include using anti-CSRF tokens, SameSite cookie attributes, and ensuring that critical actions require re-authentication or confirmation to prevent unauthorized actions from being executed.",,,"[ CSRF ] what is cross-site request forgery ( CSRF ) , how can developer mitigate it ?","cross-site request forgery ( CSRF ) trick authenticated user submitting unintended request to a web application , exploiting the trust the app ha in the user is browser . mitigation strategy include using anti-csrf token , samesite cookie attribute , and ensuring critical action require re-authentication or confirmation to prevent unauthorized action being executed .",,
[Input Validation] Why is input validation crucial in web application security?,"Input validation is a cornerstone of web security, as it ensures that only properly formatted and expected data is processed by the application. Failure to validate input can lead to vulnerabilities like XSS, SQL injection, and buffer overflows. Implementing both client-side and server-side validation, along with whitelisting acceptable inputs, helps enforce security and application stability.",,,[ input validation ] why is input validation crucial in web application security ?,"input validation is a cornerstone of web security , it ensures only properly formatted and expected data is processed by the application . failure to validate input can lead to vulnerability XSS , SQL injection , and buffer overflow . implementing client-side and server-side validation , whitelisting acceptable input , help enforce security and application stability .",,
[Access Control] How does broken access control compromise the integrity of web applications?,"Broken access control occurs when users can access resources or perform actions beyond their authorization level, often due to flawed permission checks or URL manipulation. This compromises the integrity and confidentiality of web applications. Role-based access control, secure APIs, and thorough testing are necessary to ensure that every action is appropriately restricted and audited.",,,[ access control ] how doe broken access control compromise integrity of web application ?,"broken access control occurs when user can access resource or perform action authorization level , often due to flawed permission check or URL manipulation . compromise the integrity and confidentiality of web application . role-based access control , secure apis , and testing are necessary to ensure action is appropriately restricted and audited .",,
[HTTPS] Why is enforcing HTTPS critical for web applications today?,"Enforcing HTTPS ensures that all data transmitted between the client and server is encrypted, protecting against man-in-the-middle attacks and eavesdropping. It also boosts user trust and search engine rankings. By implementing HSTS (HTTP Strict Transport Security) and redirecting all HTTP traffic to HTTPS, web applications can ensure secure communication across all sessions.",,,[ HTTPS ] why is enforcing HTTPS critical for web application today ?,"enforcing HTTPS ensures data transmitted the client and server is encrypted , protecting man-in-the-middle attack and eavesdropping . it also boost user trust and search engine ranking . by implementing hsts ( HTTP strict transport security ) and redirecting HTTP traffic to HTTPS , web application can ensure secure communication session .",,
[Security Headers] What role do security headers play in strengthening web application defenses?,"Security headers like Content Security Policy (CSP), X-Content-Type-Options, X-Frame-Options, and Strict-Transport-Security guide browsers on how to handle content and requests securely. These headers help prevent common attacks such as clickjacking, MIME-type sniffing, and code injection, making them a simple yet powerful layer of defense in web application security.",,,[ security header ] what role do security header play in strengthening web application defense ?,"security header content security policy ( csp ) , x-content-type-options , x-frame-options , and strict-transport-security guide browser on how to handle content and request securely . header help prevent common attack such clickjacking , mime-type sniffing , and code injection , making a simple yet powerful layer of defense in web application security .",,
[API Security] What are the key considerations in securing web application APIs?,"Securing APIs involves ensuring proper authentication, rate limiting, input validation, and access control to prevent unauthorized access and abuse. APIs are often targeted due to their direct access to backend systems, so using secure tokens (like JWT), implementing strict CORS policies, and logging API activity are vital for maintaining a secure application ecosystem.",,,[ API security ] what are key consideration in securing web application apis ?,"securing apis involves ensuring proper authentication , rate limiting , input validation , and access control to prevent unauthorized access and abuse . apis are often targeted due to direct access to backend system , using secure token ( JWT ) , implementing strict CORS policy , and logging API activity are vital for maintaining a secure application ecosystem .",,
[Vulnerabilities] What is the significance of the OWASP Top 10 in web application security?,"The OWASP Top 10 is a widely recognized standard that outlines the most critical security risks to web applications, serving as a foundational guide for developers and security professionals. It highlights common vulnerabilities such as injection flaws, broken authentication, and sensitive data exposure. Understanding and mitigating these risks helps teams prioritize security efforts and align development practices with industry best standards.",,,[ vulnerability ] what is significance of owasp top 10 in web application security ?,"the owasp top 10 is a widely recognized standard outline the most critical security risk to web application , serving a foundational guide for developer and security professional . it highlight common vulnerability such injection flaw , broken authentication , and sensitive data exposure . understanding and mitigating risk help team prioritize security effort and align development practice industry best standard .",,
[Authorization] How does improper authorization differ from authentication issues in web applications?,"While authentication verifies a user's identity, authorization determines what actions that user is allowed to perform. Improper authorization occurs when users can access resources or functions they shouldn't, often due to logic flaws or missing access checks. These issues can lead to privilege escalation and data breaches, making it essential to enforce strict role-based access controls and verify permissions on both client and server sides.",,,[ authorization ] how doe improper authorization differ authentication issue in web application ?,"authentication verifies a user is identity , authorization determines what action user is allowed to perform . improper authorization occurs when user can access resource or function not , often due to logic flaw or missing access check . issue can lead to privilege escalation and data breach , making it essential to enforce strict role-based access control and verify permission on client and server side .",,
[Cookies] How can cookies be secured to protect user sessions in web applications?,"Securing cookies involves setting attributes like Secure, HttpOnly, and SameSite to prevent them from being accessed by malicious scripts or transmitted over unencrypted connections. These configurations help mitigate risks such as cross-site scripting and session hijacking, ensuring that session tokens and other sensitive information remain protected during a user's interaction with a web application.",,,[ cooky ] how can cooky be secured to protect user session in web application ?,"securing cooky involves setting attribute secure , httponly , and samesite to prevent being accessed by malicious script or transmitted unencrypted connection . configuration help mitigate risk such cross-site scripting and session hijacking , ensuring session token and other sensitive information remain protected a user is interaction a web application .",,
[Error Handling] Why is proper error handling important for web application security?,"Proper error handling prevents attackers from gaining insights into an application’s internal workings, which can be exploited for targeted attacks. Revealing stack traces, database errors, or server paths can provide clues about technologies and potential vulnerabilities. Secure error handling involves logging errors internally while displaying generic, user-friendly messages to the client, minimizing the information leakage.",,,[ error handling ] why is proper error handling important for web application security ?,"proper error handling prevents attacker gaining insight application s internal working , can be exploited for targeted attack . revealing stack trace , database error , or server path can provide clue technology and potential vulnerability . secure error handling involves logging error internally displaying generic , user-friendly message to the client , minimizing the information leakage .",,
[File Uploads] What security concerns arise from allowing file uploads in web applications?,"File uploads can introduce significant risks such as malware distribution, server-side script execution, or denial-of-service attacks. To mitigate these risks, applications must validate file types, enforce size limits, rename files, and store them outside the web root. Additionally, scanning uploads with antivirus software and disabling direct execution can further secure this common feature.",,,[ file uploads ] what security concern arise allowing file uploads in web application ?,"file uploads can introduce significant risk such malware distribution , server-side script execution , or denial-of-service attack . to mitigate risk , application validate file type , enforce size limit , rename file , and store the web root . additionally , scanning uploads antivirus software and disabling direct execution can further secure common feature .",,
"[Input Sanitization] How does input sanitization differ from input validation, and why is it necessary?","Input sanitization modifies user input to neutralize potentially harmful content, whereas validation ensures the input meets expected formats and rules. Both are essential for defense-in-depth; validation blocks invalid inputs, and sanitization ensures that accepted data is safe for processing. Together, they help prevent a range of attacks including XSS, SQL injection, and command injection.",,,"[ input sanitization ] how doe input sanitization differ input validation , why is it necessary ?","input sanitization modifies user input to neutralize potentially harmful content , whereas validation ensures the input meet expected format and rule . are essential for defense-in-depth ; validation block invalid input , and sanitization ensures accepted data is safe for processing . together , help prevent a range of attack including XSS , SQL injection , and command injection .",,
[Security Testing] What is the importance of regular security testing in web application development?,"Regular security testing, including static code analysis, dynamic testing, and penetration testing, helps identify and remediate vulnerabilities before attackers can exploit them. Incorporating testing into the development lifecycle ensures that security is not an afterthought and that applications remain resilient against evolving threats throughout their deployment.",,,[ security testing ] what is importance of regular security testing in web application development ?,"regular security testing , including STATIC code analysis , DYNAMIC testing , and penetration testing , help identify and remediate vulnerability attacker can exploit . incorporating testing the development lifecycle ensures security is not afterthought and application remain resilient evolving threat deployment .",,
[Brute Force] How can web applications defend against brute force login attempts?,"Brute force attacks involve systematically guessing login credentials until access is gained. To prevent this, web applications can implement account lockouts after repeated failures, enforce strong password policies, use CAPTCHA challenges, and log unusual login behavior. Additionally, rate limiting and multi-factor authentication add robust layers of defense against such attacks.",,,[ brute force ] how can web application defend brute force login attempt ?,"brute force attack involve systematically guessing login credential access is gained . to prevent , web application can implement account lockout repeated failure , enforce strong password policy , use captcha challenge , and log unusual login behavior . additionally , rate limiting and multi-factor authentication add robust layer of defense such attack .",,
"[Security Misconfiguration] What is security misconfiguration, and how can it be avoided in web applications?","Security misconfiguration refers to using insecure default settings, unnecessary features, or outdated software, which can expose web applications to attacks. Avoiding it involves hardening server configurations, regularly updating software, disabling unused services, and applying the principle of least privilege. Automated scanning and adherence to configuration standards can also help detect and correct misconfigurations early.",,,"[ security misconfiguration ] what is security misconfiguration , how can it be avoided in web application ?","security misconfiguration refers to using insecure default setting , unnecessary feature , or outdated software , can expose web application to attack . avoiding it involves hardening server configuration , regularly updating software , disabling unused service , and applying the principle of least privilege . automated scanning and adherence to configuration standard can also help detect and correct misconfigurations early .",,
[Third-Party Components] Why do third-party components pose a risk to web application security?,"Third-party components, such as libraries and frameworks, can introduce vulnerabilities if they are outdated, poorly maintained, or maliciously modified. Since these components often run with the same privileges as the application, their compromise can have serious consequences. Regularly updating dependencies, using trusted sources, and employing software composition analysis tools are crucial for maintaining a secure codebase.",,,[ third-party component ] why do third-party component pose a risk to web application security ?,"third-party component , such library and framework , can introduce vulnerability are outdated , poorly maintained , or maliciously modified . component often run the same privilege the application , compromise can have serious consequence . regularly updating dependency , using trusted source , and employing software composition analysis tool are crucial for maintaining a secure codebase .",,
[Web Security] Explain why the Same-Origin Policy in web browsers is important for web application security.,"The Same-Origin Policy (SOP) is a crucial security feature in web browsers that restricts interactions between scripts and resources from different origins, where an origin is defined by the combination of protocol, domain, and port. This policy prevents malicious websites from accessing data on another site where the user is authenticated, protecting against attacks such as Cross-Site Scripting (XSS) and Cross-Site Request Forgery (CSRF). By isolating content from different origins, SOP upholds the confidentiality and integrity of user data and ensures that potentially harmful scripts cannot tamper with or extract sensitive information from another site.",,,[ web security ] explain why same-origin policy in web browser is important for web application security .,"the same-origin policy ( sop ) is a crucial security feature in web browser restricts interaction script and resource different origin , where origin is defined by the combination of protocol , domain , and port . policy prevents malicious website accessing data on site where the user is authenticated , protecting attack such cross-site scripting ( XSS ) and cross-site request forgery ( CSRF ) . by isolating content different origin , sop upholds the confidentiality and integrity of user data and ensures potentially harmful script can not tamper or extract sensitive information site .",,
[Web Security] How do Content Security Policies (CSP) help in mitigating web-based attacks like XSS?,"Content Security Policies (CSP) serve as a browser-enforced layer of defense that helps prevent attacks like Cross-Site Scripting (XSS) by defining which sources of content are allowed to load and execute on a webpage. By specifying trusted domains for scripts, styles, and other resources, CSP restricts the execution of inline scripts and blocks unauthorized code injections. This minimizes the chances of malicious scripts being executed on the client side, thereby reinforcing the application’s resilience against script-based attacks. Properly configured CSP headers act as a powerful tool in a developer’s security arsenal, particularly when combined with other best practices.",,,[ web security ] how do content security policy ( csp ) help in mitigating web-based attack XSS ?,"content security policy ( csp ) serve a browser-enforced layer of defense help prevent attack cross-site scripting ( XSS ) by defining source of content are allowed to load and execute on a webpage . by specifying trusted domain for script , style , and other resource , csp restricts the execution of inline script and block unauthorized code injection . minimizes the chance of malicious script being executed on the client side , thereby reinforcing the application s resilience script-based attack . properly configured csp header act a powerful tool in a developer s security arsenal , particularly when combined other best practice .",,
[Web Security] What is the difference between authentication and authorization in web applications?,"Authentication and authorization are foundational yet distinct concepts in web application security. Authentication is the process of verifying a user's identity, typically through credentials such as a password, token, or biometric input. Once a user is authenticated, authorization determines what resources or actions the user is permitted to access based on predefined roles or privileges. For instance, while authentication may confirm a user's identity as valid, authorization governs whether they can access sensitive areas like admin dashboards or restricted APIs. Implementing both effectively ensures that systems not only recognize users but also enforce appropriate access control.",,,[ web security ] what is difference authentication authorization in web application ?,"authentication and authorization are foundational yet distinct concept in web application security . authentication is the process of verifying a user is identity , typically credential such a password , token , or biometric input . once a user is authenticated , authorization determines what resource or action the user is permitted to access based on predefined role or privilege . for instance , authentication may confirm a user is identity valid , authorization governs can access sensitive area admin dashboard or restricted apis . implementing effectively ensures system not only recognize user but also enforce appropriate access control .",,
[Web Security] How can developers secure APIs exposed by web applications against misuse or attacks?,"Securing web APIs involves employing layered defenses including authentication, authorization, input validation, rate limiting, and encryption. Developers should use mechanisms like API keys, OAuth 2.0, or JWTs to authenticate users and ensure that only legitimate clients can access API endpoints. Authorization logic must enforce permissions rigorously, preventing unauthorized data access or modification. Input validation is essential to guard against injection attacks, while rate limiting protects against abuse such as denial-of-service (DoS) or brute-force attempts. All communication should be conducted over HTTPS to preserve data confidentiality and integrity during transmission, and security monitoring should be used to detect anomalies.",,,[ web security ] how can developer secure apis exposed by web application misuse or attack ?,"securing web apis involves employing layered defense including authentication , authorization , input validation , rate limiting , and ENCRYPTION . developer use mechanism API key , OAUTH , or jwts to authenticate user and ensure only legitimate client can access API endpoint . authorization logic enforce permission rigorously , preventing unauthorized data access or modification . input validation is essential to guard injection attack , rate limiting protects abuse such denial-of-service ( DOS ) or brute-force attempt . communication be conducted HTTPS to preserve data confidentiality and integrity transmission , and security monitoring be used to detect anomaly .",,
"[Web Security] What is input validation, and why is it crucial for web application security?","Input validation ensures that only properly formed data is accepted by the application, preventing malicious input that could lead to attacks like SQL injection, XSS, and buffer overflows. Strong input validation is a foundational security control",,,"[ web security ] what is input validation , why is it crucial for web application security ?","input validation ensures only properly formed data is accepted by the application , preventing malicious input lead to attack SQL injection , XSS , and buffer overflow . strong input validation is a foundational security control",,
[Web Security] How does a Web Application Firewall (WAF) protect web applications?,"A WAF monitors and filters HTTP traffic, blocking malicious requests and attacks such as XSS, SQL injection, and file inclusion. It acts as a shield between users and the web application, providing real-time protection",,,[ web security ] how doe a web application FIREWALL ( waf ) protect web application ?,"a waf monitor and filter HTTP traffic , blocking malicious request and attack such XSS , SQL injection , and file inclusion . it act a shield user and the web application , providing real-time protection",,
"[Web Security] What is two-factor authentication (2FA), and how does it enhance web application security?","Two-factor authentication requires users to provide two different types of credentials, such as a password and a one-time code. This additional layer makes unauthorized access significantly harder, even if one factor is compromised",,,"[ web security ] what is two-factor authentication ( ) , how doe it enhance web application security ?","two-factor authentication requires user to provide different type of credential , such a password and a one-time code . additional layer make unauthorized access significantly harder , even factor is compromised",,
"[Web Security] What is session hijacking, and how can it be prevented?","Session hijacking occurs when an attacker steals a user's session token to impersonate them. Prevention includes using secure, HTTP-only cookies, regenerating session IDs after login, and enforcing secure transport with HTTPS.",,,"[ web security ] what is session hijacking , how can it be prevented ?","session hijacking occurs when attacker steal a user is session token to impersonate . prevention includes using secure , http-only cooky , regenerating session IDS login , and enforcing secure transport HTTPS .",,
"[Web Security] What are secure coding practices, and why are they important?","Secure coding practices involve writing code that anticipates and mitigates potential vulnerabilities, such as input validation, output encoding, and avoiding insecure functions. They reduce the attack surface and prevent common vulnerabilities",,,"[ web security ] what are secure coding practice , why are important ?","secure coding practice involve writing code anticipates and mitigates potential vulnerability , such input validation , output encoding , and avoiding insecure function . reduce the attack surface and prevent common vulnerability",,
